س 1. آیا تقلید، صرفاً یک مسأله عقلی است یا ادلّه شرعی نیز دارد؟,"ج. تقلید، ادلّه شرعی دارد و عقل نیز حکم می کند که شخص ناآگاه به احکام دین باید به مجتهد جامع الشرایط مراجعه کند.
 "
س 2. به نظر شریف حضرت عالی، عمل به احتیاط بهتر است یا تقلید؟,"ج. چون عمل به احتیاط مستلزم شناسایی موارد و چگونگی احتیاط و صرف وقت بیشتر است، بهتر آن است که مکلّف در احکام دین از مجتهد جامع الشرایط تقلید کند.
 "
س 3. قلمرو احتیاط در احکام دین در بین فتاوای فقها چه اندازه است؟ آیا رعایت آرای فقیهان گذشته نیز لازم است؟,"ج. مراد از احتیاط در موارد آن، رعایت همه احتمالات فقهی است؛ به طوری که مکلّف مطمئن شود که به وظیفه خود عمل کرده است.
 "
س 4. دخترم به زودی به سن تکلیف می رسد و باید برای خود مرجع تقلیدی انتخاب کند، اما درک مسأله تقلید برای او دشوار است، وظیفه ما نسبت به او چیست؟,"ج. اگر وی به تنهایی نمی تواند وظیفه شرعی خود را در این باره تشخیص دهد، وظیفه شما ارشاد و راهنمایی اوست.
 "
س 5. نزد فقها معروف است که تشخیص موضوعات احکام به عهده خود مکلّف است و وظیفه مجتهد تشخیص حکم است، ولی در عین حال مجتهدین در بسیاری موارد، در تشخیص موضوعات احکام نیز اظهار نظر می کنند، آیا متابعت از نظر مجتهد در موضوع نیز واجب است؟,"ج. تشخیص موضوع، موکول به نظر خود مکلّف است و متابعت از مجتهد در تشخیص موضوع واجب نیست، مگر آن که به آن تشخیص اطمینان پیدا کند و یا موضوع از موضوعاتی باشد که تشخیص آن نیاز به استنباط دارد.
 "
س 6. آیا کسی که در آموختن احکام دینیِ مورد نیاز خود کوتاه ی می کند، گناهکار است؟,"ج. اگر نیاموختن احکام به ترک واجب یا ارتکاب حرام بیانجامد، گناهکار است.
 "
س 7. گاهی از افراد کم اطلاع از مسائل دینی درباره مرجع تقلیدشان پرسش می شود، می گویند نمی دانیم، یا اظهار می دارند که از فلان مجتهد تقلید می کنیم، ولی عملاً التزامی به خواندن رساله آن مجتهد و عمل به فتاوای او ندارند، اعمال این گونه افراد چه حکمی دارد؟,ج. اگر اعمال آنان موافق احتیاط یا مطابق با نظر مجتهدی باشد که در گذشته وظیفه‌ تقلید از او را داشته یا اکنون  وظیفه دارند از او تقلید کنند، محکوم به صحّت است.
س 8. با توجه به این که در مسائلی که مجتهد اعلم قائل به وجوب احتیاط است، می توانیم به مجتهد اعلم بعد از وی مراجعه کنیم، اگر اعلم بعد از او نیز قائل به وجوب احتیاط در مسأله باشد، آیا رجوع به اعلم بعد از او جایز است؟ و اگر فتوای مجتهد سوم هم همان گونه بود، آیا می توان به اعلم بعد از آنان مراجعه کرد؟ و همین طور...، لطفاً این مسأله را توضیح دهید.,ج. در مسائلی که مجتهد اعلم احتیاط کرده، رجوع به مجتهدی که در آن مسأله احتیاط نکرده است و فتوای صریح دارد، با رعایت ترتیب الاعلم فالاعلم، اشکال ندارد.
س 9. آیا تقلید از مجتهدی که متصدی مقام مرجعیت نبوده و رساله عملیه هم ندارد، جایز است؟,"ج. در صحّت تقلید از مجتهد جامع الشرایط، تصدّی مرجعیت یا داشتن رساله عملیه شرط نیست، لذا اگر برای مکلّفی که قصد تقلید از او را دارد، ثابت شود که وی مجتهد جامع الشرایط است، تقلید اشکال ندارد.
 "
س 10. آیا تقلید از کسی که در یکی از ابواب فقه مثل نماز و روزه به درجه ی اجتهاد رسیده، جایز است؟,ج. فتوای مجتهد متجزّی برای خودش حجت است و دیگران هم می‌توانند در همان ابواب فقهی که تبحّر دارد، از او تقلید کنند، گر چه احتیاط مستحب آن است که از مجتهد مطلق تقلید کنند.
س 11. آیا تقلید از علمای کشورهای دیگر که دست رسی به آنان امکان ندارد، جایز است؟,"ج. در تقلید از مجتهد جامع الشرایط شرط نیست که مجتهد اهل کشور مکلّف و یا ساکن در محل سکونت او باشد.
 "
س 12. آیا عدالت معتبر در مجتهد و مرجع تقلید با عدالت معتبر در امام جماعت از حیث شدّت و ضعف تفاوت دارد؟,"ج. با توجه به حسّاسیّت و اهمیت منصب مرجعیت در فتوا، بنا بر احتیاط واجب، شرط است که مجتهدِ مرجع تقلید علاوه بر عدالت، قدرت تسلّط بر نفس سرکش را داشته و حرص به دنیا نداشته باشد.
 "
س 13. این که گفته می شود باید از مجتهدی تقلید نمود که عادل باشد، مقصود از عادل چه کسی است؟,"ج. عادل کسی است که پرهیزگاری او به حدی رسیده باشد که از روی عمد مرتکب گناه نشود.
 "
س 14. آیا اطلاع از اوضاع زمان و مکان از شرایط اجتهاد است؟,"ج. ممکن است این شرط در بعضی از مسائل دخیل باشد.
 "
س 15. بنا بر نظر حضرت امام راحل(قدّس سرّه) مرجع تقلید باید علاوه بر علم به احکام عبادات و معاملات، نسبت به همه امور سیاسی، اقتصادی، نظامی ، اجتماعی و رهبری، عالم و آگاه باشد. ما در گذشته مقلّد حضرت امام بودیم، بعد از رحلت ایشان با راهنمایی تعدادی از علما و تشخیص خودمان لازم دانستیم به جناب عالی رجوع نموده و از شما تقلید کنیم تا بین مرجعیت و رهبری جمع کرده باشیم، نظر شما در این مورد چیست؟,"ج. شرایط صلاحیت مرجعیت تقلید، در تحریرالوسیله و رساله های دیگر به تفصیل ذکر شده است، و تشخیص فرد شایسته تقلید موکول به نظر خود مکلّف است.
 "
س 16. آیا در تقلید، اعلمیّت مرجع شرط است یا خیر؟ معیار و ملاک اعلمیّت چیست؟,ج. در مسائلی که فتوای اعلم با فتوای غیر اعلم اختلاف دارد، احتیاط آن است که از اعلم تقلید کند و ملاک اعلمیت این است که آن مرجع نسبت به سایر مراجع قدرت بیشتری بر شناخت حکم الهی داشته باشد و بهتر بتواند احکام شرعیه را از ادلّه استنباط کند به طوری که تفاوت او با دیگران برای اهل فن آشکار باشد و همچنین نسبت به اوضاع زمان خود به مقداری که در تشخیص موضوعات احکام و ابراز نظر فقهی مؤثر است، آگاه تر باشد.
س 17. آیا تقلید کسی که از جهت احتمال عدم وجود شرایط معتبر تقلید در مجتهد اعلم، از مجتهد غیر اعلم تقلید کرده است، محکوم به بطلان است؟,"ج. بنا بر احتیاط، تقلید از غیر اعلم در مسائل مورد اختلاف، به مجرد احتمال عدم وجود شرایط معتبر در اعلم، جایز نیست.
 "
س 18. اگر ثابت شود که تعدادی از علما در بعضی از مسائل اعلم هستند، یعنی هر کدام از آنان در مسأله معیّنی اعلم باشند، آیا تقلید از هر یک از آنان جایز است؟,"ج. تبعیض در تقلید اشکال ندارد و اگر اعلمیّت هر یک از آنان در مسائلی که مکلف بنا دارد در آن مسائل از او تقلید کند محرز شود، بنا بر احتیاط، تبعیض در تقلید در صورت اختلاف فتوا در مسائل مورد نیاز مقلّد، واجب است.
 "
س 19. آیا با وجود اعلم، تقلید از غیر اعلم جایز است؟,"ج. در مسائلی که فتوای غیر اعلم مخالفِ فتوای اعلم نباشد، رجوع به غیر اعلم اشکال ندارد.
 "
س 20. نظر جناب عالی در اشتراط اعلمیت مرجع تقلید چیست و دلیل آن کدام است؟,"ج. در صورت تعدّد فقهای جامع الشرایط و اختلاف آنان در فتوا، بنا بر احتیاط واجب، مکلّف باید از اعلم تقلید نماید، مگر آن که احراز شود که فتوای وی مخالف احتیاط است و فتوای غیر اعلم موافق با احتیاط. و دلیل وجوب تقلید از اعلم بنای عقلا و حکم عقل است، زیرا که اعتبار فتوای اعلم برای مقلد یقینی و اعتبار قول غیر اعلم احتمالی است.
 "
س 21. از چه کسی باید تقلید کنیم؟,"ج. از مجتهدی که جامع شرایطِ فتوا و مرجعیت است، و بنا بر احتیاط باید اعلم هم باشد.
 "
س 22. آیا تقلید ابتدایی از میّت جایز است؟,"ج. در تقلید ابتدایی، احتیاط در تقلید از مجتهد زنده و اعلم نباید ترک شود.
 "
س 23. آیا تقلید ابتدایی از مجتهد میّت، متوقف بر تقلید از مجتهد زنده است؟,"ج. تقلید ابتدایی از مجتهد میّت یا بقا بر تقلید او باید به تقلید از مجتهد زنده و اعلم باشد.
 "
س 24. بعد از احراز صلاحیت مجتهدی برای مرجعیت تقلید به وسیله شهادت دو فرد عادل، آیا لازم است در این باره از اشخاص دیگر نیز تحقیق کنم؟,ج. شهادت دو فرد عادل و اهل خبره بر صلاحیت و جامع الشرایط بودن مجتهد برای جواز تقلید از او کافی است و تحقیق از افراد دیگر لازم نیست.
س 25. راه ها ی انتخاب مرجع و به دست آوردن فتوا کدام است؟,"ج. احراز اجتهاد و اعلمیت مرجع تقلید به وسیله امتحان یا تحصیل یقین ولو از شهرت مفیدِ علم یا اطمینان، یا با شهادت دو نفر عادل از اهل خبره صورت می گیرد.
  راه ها ی به دست آوردن فتوای مجتهد عبارتند از:
  1. شنیدن از خود مجتهد
  2. خبر دادن یک شخص عادل یا یک شخص مورد اطمینان از خود مجتهد یا از رساله قابل اطمینان او
  3. مراجعه به رساله قابل اطمینان. "
س 26. آیا وکالت در انتخاب مرجع مثل وکالت پدر برای پسر و معلم برای شاگرد صحیح است؟,ج. اگر مراد از وکالت، سپردن وظیفه تحقیق و جستجو برای یافتن مجتهد جامع الشرایط به پدر، معلم، مربی و یا غیر آنان باشد، اشکال ندارد و نظرشان در این مورد اگر مفیدِ علم یا اطمینان و یا واجد شرایط بیّنه و شهادت باشد، از نظر شرعی معتبر و حجت است.
س 27. از تعدادی از علماء که خود مجتهد بودند، راجع به فرد اعلم سؤال شد. فرمودند که رجوع به فلان مجتهد دامت افاضاته باعث برائت ذمّه می گردد. آیا با آن که شخصاً اطلاع از اعلمیت آن مجتهد ندارم و یا در این باره شک دارم و یا اطمینان دارم که اعلم نیست، زیرا افراد دیگری که با دلیل و بینه مشابه اعلمیت آنان ثابت شده است، وجود دارند، می توانم به گفته آنان اعتماد کرده و از آن مجتهد تقلید کنم؟,ج. اگر بیّنه شرعی بر اعلمیت مجتهد جامع الشرایط اقامه شود، تا زمانی که بیّنه شرعی دیگری که معارض آن باشد پیدا نشود، آن بیّنه حجت شرعی است و به آن اعتماد می شود، اگرچه موجب حصول علم یا اطمینان نباشد، در این صورت جستجو از بیّنه معارض و احراز عدم وجود آن لازم نیست.
س 28. آیا جایز است کسی که اجازه از مجتهد ندارد و در بعضی از موارد مرتکب اشتباه در نقل فتوا و احکام شرعی شده است، متصدی نقل فتوای مجتهد و بیان احکام شرعی شود؟ وظیفه ما در صورتی که این شخص احکام را از روی رساله عملیه نقل می کند، چیست؟,ج. در تصدی نقل فتوای مجتهد و بیان احکام شرعی، اجازه داشتن شرط نیست، ولی اگر در موردی اشتباه کرد، چنانچه متوجه اشتباه خود شد، در صورت امکان باید اشتباه را برطرف کند. به هر حال، بر مستمع جایز نیست تا اطمینان به صحّت گفتار گوینده پیدا نکرده، به نقل او عمل کند.
"
س 29. تا به حال در بقا بر تقلید از میّت، به اجازه مجتهد غیر اعلم عمل می کردیم. اگر اجازه مجتهد اعلم شرط بقا بر تقلید از میّت است، آیا عدول به اعلم و طلب اجازه او برای بقا بر میّت بر ما واجب است؟",ج. اگر فتوای غیر اعلم موافق با فتوای اعلم در این مسأله باشد، عمل به فتوای غیر اعلم اشکال ندارد و نیازی به عدول به اعلم نیست.
س 30. آیا در عدول از یکی از فتاوای امام خمینی(قدّس سرّه) واجب است به فتوای مجتهدی که از او برای بقا بر تقلید میّت اجازه گرفته ام، رجوع کنم یا آن که به فتوای سایر مجتهدین هم می شود عمل کرد؟,ج. احتیاط در رجوع به فتاوای همان مجتهد است، مگر آن که مجتهد زنده دیگر اعلم از آن مجتهد و فتوای او در مسأله مورد عدول مخالف فتوای مجتهد اول باشد، که احتیاط واجب در این صورت، رجوع به مجتهد اعلم است.
س 31. آیا تغییر مرجع تقلید جایز است؟,ج. عدول از مجتهد زنده، به مجتهد زنده دیگر بنا بر احتیاط واجب جایز نیست مگر این که اعلم یا محتمل الاعلمیه باشد.
س 32. جوانی هستم ملتزم به احکام شرعی، در گذشته قبل از رسیدن به سن تکلیف مقلد حضرت امام(قدّس سرّه) بودم، ولی این تقلید مبتنی بر بیّنه شرعی نبود بلکه بر این اساس بود که تقلید از امام سبب برائت ذمّه می گردد. بعد از مدّتی به مرجع دیگری عدول کردم، در حالی که این عدول هم صحیح نبود و بعد از درگذشت آن مرجع، به جناب عالی عدول کردم. لطفاً حکم تقلیدم از آن مرجع و حکم اعمالم در آن مدت و تکلیف فعلی ام را بیان فرمایید.,ج. آن دسته از اعمال شما که بر اساس فتوای امام(قدّس سرّه)، چه در حال حیات با برکت وی و چه بعد از رحلت ایشان، بنا بر بقا بر تقلید از امام(قدّس سرّه) انجام گرفته ، محکوم به صحّت است. ولی اعمالی که به تقلید غیر منطبق با موازین شرعی از مرجع دیگری انجام یافته، اگر منطبق با فتوای کسی که هم اکنون باید از او تقلید کنید، باشد، محکوم به صحّت و موجب برائت ذمّه است، و الّا قضای آن ها بر شما واجب است. در حال حاضر شما بین بقا بر تقلید از امام راحل طاب ثراه و بین عدول به کسی که بر اساس موازین شرعی او را شایسته تقلید می دانید، مخیّر هستید.
س 33. شخصی که مقلّد امام(قدّس سرّه) بوده، پس از ارتحال ایشان از مرجع معیّنی تقلید نموده است. در حال حاضر می خواهد دوباره از امام تقلید نماید. آیا این تقلید جایز است؟,ج. رجوع از مجتهد زنده جامع الشرایط به مجتهد میّت بنا بر احتیاط، جایز نیست. ولی اگر مجتهد زنده در زمان عدول به او واجد شرایط نبوده است، عدول به او از همان ابتدا باطل بوده، و این فرد در حال حاضر اختیار دارد که همچنان بر تقلید امام(قدّس سرّه) باقی بماند و یا به مجتهد زنده ای که تقلیدش جایز است، عدول کند.
س 34. من در زمان حیات امام خمینی(ره) به سن تکلیف رسیده و در بعضی از احکام از ایشان تقلید کردم، در حالی که مسأله تقلید به خوبی برایم معلوم نبود، اکنون چه تکلیفی دارم؟,ج. اگر در اعمال عبادی و غیر عبادی در زمان حیات امام(ره) به فتاوای ایشان عمل نموده اید، و عملاً مقلد ایشان، هرچند در بعضی از احکام، بوده اید، در حال حاضر بقا بر تقلید حضرت امام(ره) در همه مسائل برای شما جایز است.
س 35. حکم بقا بر تقلید میّت اگر اعلم باشد، چیست؟,ج. بقا بر تقلید میّت حتی در صورت اعلم بودن او واجب نیست؛ ولی سزاوار است که احتیاط در بقا بر تقلید میّتِ اعلم ترک نشود. 
س 36. آیا در بقا بر تقلید میّت، اجازه از مجتهد اعلم معتبر است و یا اجازه هر مجتهدی کافی است؟,ج. در جواز بقا بر تقلید میّت، در صورتی که مورد اتّفاق فقها باشد، اجازه از اعلم واجب نیست.
س 37. شخصی که از امام راحل(قدّس سرّه) تقلید می کرده و بعد از رحلت ایشان در بعضی از مسائل از مجتهد دیگری تقلید کرده است، اکنون آن مجتهد نیز وفات نموده است، این شخص چه تکلیفی دارد؟,ج. می تواند مانند گذشته، بر تقلید از امام (قدّس سرّه)، در مسائلی که از ایشان عدول نکرده، باقی بماند. همچنان که مخیّر است در مسائلی که عدول نموده بر فتوای مجتهد دوم باقی بماند و یا به مجتهد زنده عدول کند.
س 38. بعد از وفات امام راحل(قدّس سرّه) گمان می کردم که بنا بر فتوای ایشان بقا بر تقلید میّت جایز نیست، لذا مجتهد زنده دیگری را برای تقلید انتخاب کردم. آیا می توانم بار دیگر به تقلید از امام راحل رجوع کنم؟,ج: رجوع به تقلید از امام(قدّس سرّه) بعد از عدول از ایشان به مجتهد زنده در مسائلی که عدول نموده اید، بنابر احتیاط جایز نیست، مگر این که فتوای مجتهد زنده، وجوب بقا بر تقلید میّت اعلم باشد، و شما معتقد باشید که امام(ره) نسبت به مجتهد زنده اعلم است، که در این صورت بقا بر تقلید امام (ره) واجب است.
"س 39. آیا جایز است که در یک مسأله با وجود اختلاف در فتوا گاهی به فتوای مجتهد میّت رجوع کنم
و گاهی به فتوای مجتهد زنده اعلم؟",ج: بقا بر تقلید میّت تا زمانی که به مجتهد زنده عدول نشده، جایز است و پس از عدول، رجوع مجدد به میّت بنابر احتیاط جایز نیست.
س 40. آیا بر مقلّدین امام راحل(ره) و کسانی که قصد بقا بر تقلید از ایشان را دارند، اجازه گرفتن از یکی از مراجع زنده واجب است؟ یا این که اتّفاق اکثر مراجع و علمای اسلام بر جواز بقا بر میّت کافی است؟,ج. با فرض اتّفاق علما، مبنی بر جواز بقا بر تقلید از میّت، بقا بر تقلید امام(ره) جایز است و در این مورد نیازی به رجوع به مجتهد معیّنی نیست.
س 41. نظر شریف جناب عالی راجع به بقا بر تقلید از میّت در مسأله ای که مکلّف در حال حیات مرجع به آن عمل کرده و یا نکرده، چیست؟,ج. بقا بر تقلید میّت در همه مسائل حتی در مسائلی که تا کنون مکلّف به آن ها عمل نکرده است، جایز و مجزی است.
س 42. بنا بر جواز بقا بر تقلید از میّت، آیا این حکم شامل اشخاصی که در زمان حیات مجتهد مکلّف نبوده ولی به فتاوای آن مرجع عمل کرده اند، هم می شود؟,ج. اگر تقلید شخص غیربالغ از مجتهد جامع الشرایط به نحو صحیح محقق شده باشد، باقی ماندن بر تقلید همان مجتهد بعد از فوتش جایز است.
س 43. ما از مقلدین امام خمینی(ره) هستیم که بعد از رحلت جانسوز ایشان بر تقلید وی باقی مانده ایم. ولی چون در شرایط دشوار فعلی که ملت مسلمان با استکبار جهانی درگیر است، با مسائل شرعی تازه ای روبرو می شویم و احساس می کنیم باید به حضرت عالی رجوع نمائیم و از شما تقلید کنیم، آیا این کار برای ما جایز است؟,ج. بقا بر تقلید از امام(قدّس سرّه) برای شما جایز است و فعلاً نیازی به عدول از تقلید ایشان ندارید، در صورت نیاز به استعلام حکم شرعی در مسائل مستحدثه، می توانید با دفتر ما مکاتبه نمایید.
س 44. وظیفه مقلد در قبال مرجع تقلید خود در صورتی که اعلمیت مرجع دیگری را احراز نماید، چیست؟,ج. بنا بر احتیاط، واجب است در مسائلی که فتوای مرجع فعلی با فتوای مرجع اعلم اختلاف دارد، به مرجع اعلم عدول نماید.
"س 45.
1) در چه صورتی جایز است، مقلد از مرجع تقلیدش عدول کند؟
2) آیا عدول از اعلم به غیر اعلم در مواردی که فتاوای مرجع اعلم منطبق با زمان نباشد و یا عمل به آن بسیار دشوار باشد، جایز است؟","ج.
1) عدول از مرجع تقلید زنده به مجتهد دیگر، جایز نیست علی الاحوط، مگر در صورتی که مرجع دوم اعلم از مرجع اول و فتوای او در مسأله ای مخالف فتوای مجتهد اول باشد.
2) تنها گمان به ناهماهنگی فتاوای مرجع تقلید با زمان و شرایط حاکم بر آن و یا دشواری عمل به فتاوای او، سبب جواز عدول از مجتهد اعلم به مجتهد دیگر نمی شود."
" 
س 46. مراد از جاهل مقصّر چه کسی است؟",ج. جاهل مقصر به کسی گفته می شود که متوجه جهل خود بوده و راه ها ی رفع جهالت خود را هم می داند، ولی در آموختن احکام کوتاهی می کند.
