س 1. آیا تقلید، صرفاً یک مسأله عقلی است یا ادلّه شرعی نیز دارد؟,"ج. تقلید، ادلّه شرعی دارد و عقل نیز حکم می کند که شخص ناآگاه به احکام دین باید به مجتهد جامع الشرایط مراجعه کند.
 "
س 692. اگر شخصی وطنی داشته باشد که در حال حاضر در آن سکونت نمی کند، ولی گاهی با همسرش به آن جا می رود، آیا همسر او در آن جا باید مانند وی نمازش را تمام بخواند یا خیر؟ و اگر همسرش تنها به آن جا برود نمازش چه حکمی دارد؟,ج. مجرد این که آن مکان وطن شوهر اوست باعث نمی شود که وطن وی هم باشد و بر او در آن جا احکام وطن جاری شود.
س 693. آیا محل کار حکم وطن را دارد؟,ج. اشتغال به کاری در مکانی موجب نمی شود که آن مکان وطن گردد، ولی اگر در آنجا سکونت داشته باشد و بنا دارد حداقل مدت یک سال در آنجا بماند حکم مسافر را نخواهد داشت و نمازش تمام و روزه‌اش صحیح است.
س 694. مراد از اعراض از وطن چیست؟ آیا مجرد ازدواج زن و رفتن وی همراه شوهر به هر جایی که او می خواهد، اعراض محسوب می شود یا خیر؟,ج. اعراض، با خروج از وطن با تصمیم بر عدم بازگشت به آنجا و همچنین با علم یا اطمینان به عدم  امکان بازگشت، محقّق می‌شود و مجرد رفتن زن به خانة شوهر در شهر دیگر، مستلزم اعراض از وطن اصلی‌اش نیست.
س 695. خواهشمندیم نظر خود را درباره وطن اصلی و وطن دوم بیان فرمایید.,ج. وطن اصلی جایی است که انسان بخش عمده ­ای از اوایل زندگی (یعنی دوران کودکی و نوجوانی) در آنجا رشد و نمو پیدا کند و بزرگ شود و وطن دوم هم جایی است که مکلّف قصد قطعی زندگی دائم یا زندگی به مدّت طولانی(هر چند به صورت چند ماه در سال) یا زندگی بدون تعیین مدّت در آن جا داشته باشد.
س 696. پدر و مادر من از اهالی شهر ساوه هستند و هر دو در کودکی به تهران آمده و در آن سکونت کرده اند. بعد از ازدواج به شهر چالوس رفته و در آن ساکن شده اند، زیرا محل کار پدرم آن جا بوده است. بنا بر این من در تهران به دنیا آمده، ولی هرگز در آن اقامت نکرده ام، در تهران و ساوه چگونه نماز بخوانم؟,ج. در فرض مرقوم در آنجا حکم سایر مسافرین را خواهید داشت.
س 697. شخصی از وطنش اعراض نکرده است و در حال حاضر حدود شش سال است که در شهر دیگری اقامت دارد، در صورتی که به وطن خود برگردد، با توجه به این که بر تقلید امام راحل(قدّس سرّه) باقی مانده، آیا نماز خود را باید تمام بخواند یا شکسته؟,ج. تا از وطن سابق خود اعراض نکرده، حکم وطن نسبت به او باقی است و نماز وی در آن جا تمام و روزه اش صحیح است.
س 698. دانشجویی خانه ای را در شهر تبریز برای تحصیل در دانشگاه آن به مدت چهار سال اجاره کرده است، همچنین وی در صورت امکان، قصد ماندن دائمی در تبریز را دارد، در حال حاضر در ایام ماه مبارک رمضان گاهی به وطن اصلی اش رفت و آمد می کند، آیا آن دو مکان، برای او دو وطن محسوب می شوند؟,ج. اگر در حال حاضر قصد قطعی بر توطّن در محل تحصیل نداشته باشد، آنجا حکم وطن را برای او نخواهد داشت. ولی در فرض مرقوم در آن مکان حکم مسافر را ندارد و نمازش تمام و روزه‌اش صحیح است و در ضمن حکم وطن بودن وطن اصلی او تا زمانی که از آن اعراض نکرده، نسبت به وی باقی است.
س 699. من در شهر کرمانشاه به دنیا آمده ام و شش سال است که در تهران ساکن هستم و بدون این که از وطن اصلی خود اعراض کرده باشم، قصد توطّن در تهران کرده ام. اگر در هر یک یا دو سال از منطقه ای به منطقه دیگری از مناطق تهران منتقل شوم، نماز و روزه ام در آن جا چه حکمی دارد؟ و چون بیشتر از شش ماه است که در منطقه جدیدی از تهران ساکن هستیم، آیا آن جا برای ما حکم وطن را دارد یا خیر؟ هنگامی که در طول روز به مناطق مختلف تهران رفت و آمد می کنیم، نماز و روزه ما چه حکمی دارد؟,ج. اگر در تهران فعلی و یا محله ای از آن قصد توطّن نموده اید، سراسر آن جا وطن شما محسوب می شود، و در تمامی محله های تهران حکم وطن بر شما جاری است و نمازتان تمام و روزه شما صحیح است و تردد شما در تهران فعلی حکم سفر را ندارد.
س 700. محل کار و سکونت فعلی شخصی از اهالی روستا در تهران است و پدر و مادر او در روستا زندگی می کنند و در آن ملک و آب دارند، این شخص برای دیدار و کمک به آن جا می رود، ولی تمایلی به بازگشت به آن جا برای سکونت ندارد، با توجه به این که آن جا زادگاه وی است، نماز و روزه اش در آن جا چه حکمی دارد؟,ج. اگر قصد مراجعت به آن روستا برای سکونت و زندگی ندارد، بلکه تصمیم به عدم مراجعت دارد، حکم وطن بر او در آن جا جاری نمی شود.
س 701. آیا محل تولد شخص هرچند در آن جا ساکن نباشد، وطن محسوب می شود؟,ج. اگر در آنجا مدتی (یعنی دوران کودکی و نوجوانی) مانده و رشد و نمو کرده باشد، تا از آن اعراض نکرده است، حکم وطن را دارد و در غیر این صورت حکم وطن را ندارد.
س 702. نماز و روزه کسی که سال های زیادی (نه سال) در سرزمینی که وطن او نیست، زندگی می کند، و در حال حاضر ممنوع الورود به وطن خود است، ولی یقین دارد که روزی به آن باز خواهد گشت، چه حکمی دارد؟,ج. در فرض سؤال بر این شخص، مسافر صدق نمی‌کند و نمازش در آنجا تمام و روزه‌اش صحیح است.
س 703. شش سال از عمرم را در روستایی و هشت سال را در شهری گذرانده و در حال حاضر برای تحصیل به مشهد آمده ام، نماز و روزه ام در هر یک از این مکان ها چه حکمی دارد؟,ج. روستای محل تولد اگر عرفاً وطن اصلی شما محسوب شود نماز شما در آنجا تمام و روزه‌تان صحیح است و در صورتیکه صدق وطن محل شک باشد جای احتیاط است و اگر در روستای مذکور به دنیا نیامده باشید در صورت شک در صدق وطن، احکام وطن را برای شما ندارد. شهری هم که چندین سال در آن ساکن بوده اید، اگر آن را به عنوان وطن انتخاب کرده باشید، تا از آن اعراض نکرده اید، حکم وطن را برای شما دارد ولی شهر مشهد اگر قصد توطن در آن را ندارید وطن شما محسوب نمی‌شود لکن اگر بنا دارید حداقل یکی دو سال در آنجا سکونت داشته باشید نمازتان در آنجا تمام و روزه‌تان صحیح است.
س 704. آیا زن در وطن و اقامت تابع شوهر است؟,ج. مجرد زوجیّت موجب تبعیّت قهری نمی شود، و زن می تواند در انتخاب وطن و قصد اقامت تابع شوهر خود نباشد. بله، اگر زن در انتخاب وطن و اعراض از آن تابع اراده همسرش باشد، قصد شوهرش برای او کافی است و شهری که همسرش با او برای زندگی دائم و به قصد توطّن به آن جا رفته است، وطن وی هم محسوب می شود و همچنین اعراض شوهر او از وطن مشترکشان با خروج از آن و رفتن به جایی دیگر، اعراض او از وطن هم محسوب می گردد، و برای اقامت ده روز در سفر، اطلاع او از قصد شوهرش مبنی بر اقامت ده روز با این فرض که وی تابع اراده شوهر است برای وی کافی است، بلکه اگر مجبور به همراهی با شوهرش در مدت اقامت در آن جا باشد، نیز حکم همین است.
س 705. جوانی با زنی از شهری دیگر ازدواج نموده است، هنگامی که این زن به خانه پدرش می رود، نمازش قصر است یا تمام؟,ج. تا زمانی که از وطن اصلی خود اعراض نکرده، نمازش در آن جا تمام است.
س 706. آیا زن و فرزندان مشمول مسأله «1284» رساله حضرت امام(قدّس سرّه) هستند؟ یعنی در تحقق سفر آن ها قصد سفر توسط آنان شرط نیست؟ و آیا وطن پدر موجب تمام بودن نماز کسانی که تابع وی هستند، می گردد؟,ج. اگر در سفر تابع پدر ولو قهراً باشند، قصد پدر برای پیمودن مسافت در صورت اطلاع آنان از آن کافی است. ولی در انتخاب وطن و اعراض از آن، اگر در تصمیم گیری و زندگی مستقل نباشند، یعنی بر حسب طبیعت و ارتکازشان تابع اراده پدر باشند، در اعراض از وطن سابق و اتخاذ وطن جدید که پدر با آن ها برای زندگی به آن جا رفته است، تابع وی خواهند بود.
س 707. نظر جناب عالی درباره شهرهای بزرگ از جهت قصد توطّن یا اقامت ده روز در آن ها چیست؟,ج. در احکام مسافر و قصد توطن و قصد اقامت ده روز، فرقی میان بلاد کبیره (شهرهای بزرگ) و معمولی نیست و با قصد توطن در یک شهر بزرگ و فراهم کردن لوازم وطنیت در آنجا یا مدتی در آنجا ماندن، تمام آن شهر حکم وطن را در باره‌ی او پیدا خواهد کرد. همچنین اگر قصد اقامت ده روز در مانند این شهر کند حکم تمام بودن نماز در مورد او در تمام محله‌های آن شهر جاری خواهد بود. خواه قصد توطن یا اقامت در محله خاصی را داشته باشد یا محله خاصی را قصد نکرده باشد.
س 708. شخصی از فتوای امام(قدّس سرّه) در مورد این که تهران از بلاد کبیره است، مطلع نبوده و پس از پیروزی انقلاب اسلامی به فتوای امام(قدّس سرّه) علم پیدا کرده است، نماز و روزه ای را که به نحو متعارف به جا آورده، چه حکمی دارد؟,ج. اگر در حال حاضر بر تقلید امام(قدّس سرّه) در آن مسأله باقی باشد، واجب است که اعمال گذشته اش را که با فتوای امام(قدّس سرّه) منطبق نیست، تدارک نماید، به این معنی که نمازهایی را که به جای شکسته، تمام خوانده به صورت شکسته قضا کند و روزه هایی را که در حال مسافرت گرفته است، قضا نماید. البته می توانید در این مساله به مجتهد زنده رجوع کنید که در این صورت نمازهای گذشته نیاز به اعاده ندارد.
س 709. من قادر بر خواندن نماز نیستم، آیا جایز است که شخصی به نیابت از من نماز بخواند؟ آیا فرقی بین این که نائب طلب اجرت کند و یا طلب اجرت نکند، وجود دارد؟,ج. شخص مکلف تا زنده است باید نمازهای واجبش را خودش، به هر نحو که می تواند، انجام دهد و نماز نائب چه با اجرت و چه بدون اجرت برای او مجزی نیست.
"س 710. کسی که نماز استیجاری می خواند:
1. آیا گفتن اذان و اقامه و سلام های سه گانه و تسبیحات اربعه به طور کامل بر او واجب است؟
2. اگر یک روز مثلاً نماز ظهر و عصر را بخواند و در روز بعد نمازهای پنجگانه را به طور کامل به جا آورد، آیا رعایت ترتیب لازم است؟
3. آیا در نماز استیجاری، ذکر خصوصیات میّت شرط است یا خیر؟",ج. ذکر خصوصیات میّت لازم نیست، و رعایت ترتیب فقط بین نمازهای ظهر و عصر یک روز و مغرب و عشای یک روز  شرط است، و هرگاه در عقد اجاره کیفیت خاصی بر اجیر شرط نشده باشد بر اجیر فقط لازم است که نماز را با واجبات آن انجام دهد.
س 711. نماز آیات چیست و علت شرعی وجوب آن کدام است؟,"ج. نماز آیات دو رکعت است که هر رکعت آن پنج رکوع و دو سجده دارد و اسباب شرعی وجوب آن عبارت است از: کسوف خورشید و خسوف ماه، اگرچه مقدار کمی از آن ها گرفته شود؛ زلزله و هر حادثه غیرعادی که باعث ترس بیشتر مردم شود مانند بادهای سیاه یا سرخ و یا زرد که غیرعادی باشند؛ تاریکی شدید، فرو رفتن زمین و ریختن کوه، صیحه آسمانی و آتشی که گاهی در آسمان ظاهر می شود. در غیر از کسوف و خسوف و زلزله، باید آن حادثه موجب ترس و وحشت بیشتر مردم شود، و حادثه ای که ترس آور نباشد و یا موجب ترس و وحشت افراد نادری گردد، اعتبار ندارد.
 "
س 712. نماز آیات چگونه باید خوانده شود؟,"ج. به چند صورت می توان آن را بجا آورد:
صورت اول: بعد از نیت و تکبیرة الاحرام، حمد و سوره خوانده شود و به رکوع برود، سپس سر از رکوع برداشته و دوباره حمد و سوره را بخواند و به رکوع رود و باز سر از رکوع بردارد و حمد و سوره بخواند و به رکوع رود و سپس سر از رکوع بردارد و همین طور ادامه دهد تا یک رکعت پنج رکوعی که قبل از هر رکوعی حمد و سوره خوانده است انجام دهد، سپس به سجده رفته و دو سجده نماید و بعد برای رکعت دوم قیام کند و مانند رکعت اول انجام دهد و دو سجده را بجا آورد و بعد از آن تشهد بخواند و سلام دهد.
صورت دوم:  در هر رکعت فقط یک حمد و سوره خوانده می­شود؛ به این صورت که سوره را پنج قسمت کرده و بعد از نیّت و تکبیرۀ الاحرام، حمد و یک قسمت از سوره را (چه یک آیه باشدیا کمتر و یا بیشتر) می­خواند و به رکوع می­ رود (البته بنابر احتیاط واجب «بِسْمِ الله الرَّحْمنِ الرَّحیمِ» را نمی‌توان یک قسمت از سوره به حساب آورد و با آن رکوع کرد) و بعد از رکوع بدون اینکه حمد بخواند، قسمت دوم سوره و سپس رکوع دوم را انجام می­دهد، و همین طور ادامه می­ دهد تا سوره­ای که پیش از هر رکوع، یک قسمت از آن را خوانده، قبل از رکوع آخر تمام شود، سپس رکوع پنجم را به­جا می‌آورد و به سجده می­رود و پس از اتمام دو سجده، رکعت دوم را مانند رکعت اول انجام داده و تشهد را خوانده و سلام می­­ دهد.
صورت سوم: یکی از رکعت‌ها را به یکی از دو صورت و رکعت دیگر را به نحو دیگر بجا آورد.
صورت چهارم: سوره ای که قسمتی از آن را در قیام پیش از رکوع اول خوانده، در قیام پیش از رکوع دوم یا سوم یا چهارم تکمیل نماید که در این صورت واجب است بعد از سر برداشتن از رکوع، سوره‌ی حمد را در قیام بعدی اعاده نموده و یک سوره یا قسمتی از آن را قرائت کند و در این صورت واجب است که آن سوره را تا قبل از رکوع پنجم به آخر برساند."
س 713. آیا وجوب نماز آیات اختصاص به کسانی دارد که در شهر وقوع حادثه هستند و یا شامل همه مکلفینی که از آن مطلع شده اند هرچند در آن شهر نباشند نیز می شود؟,ج. وجوب آن مختص کسانی است که هنگام وقوع حادثه، در آن مکان باشند.
س 714. اگر شخصی هنگام وقوع زلزله بیهوش باشد و بعد از وقوع آن به هوش آید، آیا نماز آیات بر او واجب است؟,ج.  در فرض مرقوم احتیاط واجب آن است که آن را بخواند.
س 715. بعد از وقوع زلزله در منطقه ای، غالباً در مدت کمی ده ها پس لرزه رخ می دهد، حکم نماز آیات در این موارد چیست؟,"ج. هر زلزله ای، چه شدید و چه خفیف، اگر زلزله مستقلی محسوب شود، نماز آیات جداگانه ای دارد.
 "
س 716. اگر مرکز زلزله نگاری، وقوع لرزش های خفیف زمین را با ذکر تعداد آن در منطقه ای که ما زندگی می کنیم، اعلام نماید، ولی ما اصلاً آن ها را احساس نکنیم، آیا در این حالت نماز آیات بر ما واجب می شود یا خیر؟,ج. اگر به‌گونه‌ای است که کسی آن را احساس نمی‌کند و فقط با دستگاهها، قابل درک باشد، نماز آیات واجب نیست.
س 717. آیا باید نمازهای نافله بلند خوانده شود یا آهسته؟,ج. مستحبّ است که نافله های روز آهسته و نافله های شب بلند خوانده شود.
س 718. آیا جایز است نماز شب را که دو رکعت دو رکعت خوانده می شود، به صورت دو نماز چهار رکعتی و یک دو رکعتی و یک نماز وتر خواند؟,ج. خواندن نماز شب به صورت نماز چهار رکعتی صحیح نیست.
س 719. آیا هنگام خواندن نماز شب، واجب است که کسی متوجه نماز شب خواندن ما نشود؟ آیا واجب است که آن را در تاریکی بخوانیم؟,ج. در تاریکی خواندن و مخفی کردن از دیگران شرط نیست، اما ریا هم در آن جایز نیست.
س 720. آیا خواندن نافله ظهر و عصر، پس از ادای نماز ظهر و عصر و در وقت نافله، باید به قصد قضا باشد و یا به قصد دیگری؟,ج. در این هنگام، احوط ادای آن به قصد قربة الی الله، بدون قصد ادا و قضا است.
س 721. خواهشمندیم کیفیت نماز شب را به تفصیل برای ما بیان فرمایید.,ج. نماز شب یازده رکعت است، هشت رکعت آن که به صورت دو رکعتی دو رکعتی خوانده می شود، نماز شب نام دارد و دو رکعت آن نماز شفع است که مانند نماز صبح خوانده می شود، و یک رکعت هم نماز وتر نام دارد که در قنوت آن استغفار و دعا برای مؤمنین و طلب حاجات از خداوند منّان به ترتیبی که در کتاب های ادعیه ذکر شده، مستحبّ است.
س 722. نماز شب به چه صورتی باید خوانده شود؟ یعنی کیفیت آن از جهت سوره و استغفار و دعا چگونه است؟,ج. در نماز شب سوره و استغفار و دعا به عنوان جزئیت شرط نیست، بلکه کافی است که در هر رکعت بعد از نیّت و تکبیرةالاحرام، سوره حمد قرائت شود، و اگر خواست بعد از قرائت حمد یک سوره از سوره های قرآن را هم قرائت کند، و رکوع و سجود و ذکر آن ها و تشهد و سلام به جا آورد.
س 723. چگونه باید افراد خانواده را برای خواندن نماز صبح بیدار نمود؟,ج. در این مورد کیفیت خاصی در رابطه با افراد خانواده وجود ندارد.
س 724. نماز و روزه کسانی که به گروه ها و طایفه های مختلفی منسوب هستند و نسبت به هم بغض و حسد و حتی دشمنی بدون دلیل دارند، چه حکمی دارد؟,ج. برای مکلّف اظهار حسد و کینه و دشمنی با دیگران جایز نیست، ولی این امور باعث بطلان نماز و روزه نمی شود.
س 725. اگر رزمنده ای در جبهه به علت شدت درگیری قادر بر قرائت فاتحه یا سجده و یا رکوع نباشد، چگونه باید نمازش را در آن جا بخواند؟,ج. باید به هر نحوی که برایش امکان دارد، نماز بخواند. اگر قادر بر انجام رکوع و سجده نیست، ایماء و اشاره به جای رکوع و سجود کافی است.
س 726. پدر و مادر به فرزندانشان در چه سنی احکام شرعی و عبادات را باید تعلیم دهند؟,ج. مستحبّ است که ولیّ اطفال احکام شرعی و عبادات را پس از رسیدن آنان به سن تمیز به ایشان یاد دهد.
س 727. بعضی از رانندگان اتوبوس های مسافربری که بین شهرها رانندگی می کنند، به نماز مسافران اهمیتی نمی دهند و به تقاضای آنان برای توقف اتوبوس جهت ادای نماز، توجهی نمی کنند، لذا گاهی نماز مسافرین قضا می شود. وظیفه رانندگان اتوبوس ها در این باره چیست؟ مسافران نسبت به نمازشان چه وظیفه ای دارند؟,ج. بر مسافران واجب است که در صورت خوف از فوت وقت نماز، از راننده بخواهند که اتوبوس را در مکان مناسبی متوقف نماید، و بر راننده اجابت درخواست آنان واجب است، و اگر به علت عذر مقبول و یا بدون دلیل از توقف اتوبوس خودداری کند، در این صورت تکلیف مسافران اگر خوف فوت وقت داشته باشند این است که نماز را در اتوبوس در همان حال حرکت بخوانند و تا آن جا که امکان دارد جهت قبله، قیام، رکوع و سجود را رعایت کنند.
س 728. آیا مقصود از این گفته که «شارب خمر تا چهل روز نماز و روزه اش نماز و روزه نیست»، این است که در این مدت بر او واجب نیست نماز بخواند و بعداً باید آن ها را قضا کند؟ یا این که مقصود جمع بین قضا و ادا است و یا آن که قضای آن ها بر او واجب نیست بلکه ادا کافی است، ولی ثواب آن از نمازهای دیگر کمتر است؟,ج. منظور این است که شرب خمر مانع از قبول نماز و روزه است[1] ، نه این که با شرب خمر وجوب ادای نماز و روزه ساقط شود و قضا واجب گردد یا جمع بین ادا و قضا لازم شود.
